Date,Content
20190113,原油价格上涨，将带动农产品价格上涨；另一方面，贸易战、国内极端天气农产品减产，都将催动国内农产品价格上涨。
20190113,市场通胀预期渐起，农产品价格上涨成为大概率事件。
20190113,原油涨价在成本端对原料纯苯形成支撑，大环境趋势向好。
20200809,建材行业：华东地区水泥出货加快，价格提前上涨，显示出下游需求的旺盛。这预示着水泥行业整体需求的提升。
20200809,钢铁行业：铁矿石到港量和钢厂库存均处于高位，短期内矿价承压。然而，下游用煤需求较好，煤炭价格有望上行。
20200809,化工行业：进口货源延迟到港，导致环氧丙烷供应紧张，价格上涨。此外，尿素和纯碱价格也呈现上涨态势。
20200809,原油市场：美国非农数据超预期，EIA库存下降，国际油价小幅上涨。
20190217,集运：2019年上半年运价有回落压力，下半年行业能否复苏尚需观察。全球经济增长放缓和贸易保护主义抑制了集运需求增长，而运力增长较快，预计2019年集运行业将处于周期底部。
20190217,原油：库存如预期下降，减产力度进一步加大支撑价格。OPEC+预计将继续增加减产力度，同时美国制裁委内瑞拉，沙特海上钻井平台的事故及利比亚油田被武装分子占领等因素也导致短期重油缺少支撑油价。
20190217,钢铁：由于铁矿石价格随后的调整和春节期间钢材库存累积较高，市场对库存压力的担心较大，期货价格在回吐前期涨幅后继续下跌。在下游实际需求未启动前，当前钢材期价基本反映了供给的高位和库存的压力，预期钢价在新开工情况明细前维持震荡。
20190217,煤炭：需求回升，煤价坚挺。耗煤量仍将继续提升，短期价格预计维持坚挺。
20190217,有色金属：受中国1月融资数据大幅超预期影响，基本金属价格受到提振。电解铝期货盘面已经出现亏损，但对于氧化铝价格的持续下降需要保持谨慎。
20190217,小金属：钼、钨、锗、铟等小金属经过长期价格低迷，全行业产能、库存逐步出清，加之环保整顿超预期推进，供给受限，但仍需对黑色链小金属价格谨慎对待。
20190217,水泥：春节过后第一周，受春节长假以及雨雪天气影响，下游市场需求仍未启动，仅有少量袋装备货需求，局部地区企业为打开市场销量，价格出现一定下调。
20190217,玻璃：春节前后玻璃生产企业出库量不大，近期北方南方的雨雪天气与长途高速运力尚未完全恢复对玻璃发运工作也造成影响，导致玻璃企业自身库存累计较快。
20190217,化工：原油价格进一步走强，农产品价格上涨成为大概率事件。供给端方面，数家新建丁酮工厂新建烷基化装置开工，导致原材料供应趋紧，部分丁酮工厂开工率下滑。
20180401,房地产行业近期受到中美贸易战影响，市场避险情绪导致行情下跌，但本周地产板块回调力度不大，预期行情回调将持续进行，存在潜在投资机会。
20180212,煤炭行业：由于供给侧改革，煤炭新增产量受限，需求稳定，煤价有望维持中高位，龙头煤企的业绩具有可持续性，估值水平存在修复空间。
20180212,房地产行业：受市场回调、房贷利率上浮等因素影响，地产股波动较大，年初累积的超额收益回落，去杠杆成为风险解读主因。
20180212,股市表现：受美股影响，本周股市经历较大跌幅，地产板块年初累积的超额收益大幅回落，投资情绪不稳定。
20191128,钢铁行业基本面改善，需求端短期需求韧性仍在，钢材社会库存去化顺畅；供给端钢价上行背景下电炉开工回升，钢材周产量上行。
20191128,后市关注点：需求端关注终端需求可延续性，关注建筑材贸易商成交量、杭州钢材库存等高频数据指标；供给端关注利润回升背景下的钢厂产量，关注废钢铁水价差、电炉开工、钢材周度产量等高频指标。
20191128,维生素行业：国外VE原料间甲酚供应短缺、价格上涨，影响VE市场供应及成本；国内VE市场成交好转，价格企稳反弹。
20191128,短期内，在原料间甲酚短缺、益曼特公司复产延迟以及后期VE减产的多重利好支撑下，VE价格大概率保持上涨趋势。
20201122,铁矿石市场：澳洲PB粉价格周环比增18元/吨。预计2021年铁矿供需紧平衡，供给不确定性较大，铁矿价格具备上涨动力。
20201122,煤炭市场：秦港动力煤价周环比增1元/吨，处于震荡行情。重点港口库存水平偏低，采暖季来临以及拉尼娜现象影响，预计动力煤价仍有上行基础。
20191105,钢铁行业供需关系发生变化，市场对明年钢材供需预期悲观，冬储意愿减弱，可能导致贸易商冬储需求走弱。
20191105,钢厂盈利状况不佳，资金实力下降，可能影响市场供应。
20190220,钢材价格受到工地复工前钢材需求和原材料供应的影响，近期市场关注焦点集中在下游需求幅度，看好钢价春季复苏行情。
20190220,钛白粉行业近期国内外巨头相继提价，海外以氯化法产品为主，原材料金红石供给偏紧，为钛白粉价格带来成本支撑。国内则以硫酸法产品为主，与海外价格联动相对有限，后期价格的上涨幅度和持续性仍有待观察。
20201018,光伏、风电表现优异的直接原因为政策推动（如碳中和、十四五规划），底层原因为成本降低实现平价上网。
20170605,3.1 SBS 主要用于制鞋和沥青改性
20170605,3.2 SIS 产能过剩，主要用于热熔胶
20170605,3.3 SEBS 和 SEPS 主要用于塑料改性和热熔胶
20170605,3.4 TPO 主要用于汽车和家用电器零部件
20191023,城市中部分钢厂分类可能以C类为主，受厄尔尼诺现象影响，今年秋冬季重污染天气可能增多，B级和C级钢企可能需要进行短期频繁限产。
20191023,三季度电解铝环节盈利有望改善，业绩将持续增长。
20190603,五月百城二手房均价持续上涨，但五大钢材表观消费量回落，其中螺纹钢跌幅较大，显示出房地产市场的热度与钢铁行业需求的背离。
20190603,产量对钢价的隐形压制作用表明，产量增加可能导致钢价下跌，从而影响到钢铁企业的利润空间。
20190603,区域供需向好，成本控制能力强的优质钢企及有望受益于铁矿石价格上行而有较好表现的铁矿石企业值得关注，显示出钢铁行业中具备竞争优势的企业有望受益于行业变化。
20190603,有机硅市场价格近期大幅下挫，主要受到中美贸易局势、下游市场需求疲软以及中低端市场竞争激烈等多重利空因素影响，显示出基础化工行业面临的挑战。
20210201,钢铁行业：受春节影响，建筑工地的施工强度减弱，长材消费明显下降，钢材价格整体维持盘整行情，小幅涨跌互现。
20210201,铁矿行业：钢铁生产季节性走弱，铁矿价格小幅回调，但钢厂仍在补库，短期内回调可能有限。
20210201,动力煤行业：受疫情及就地过年政策影响，春节期间需求可能不弱，煤价回调可能有限。
20210201,铝行业：需求呈现季节性下滑，短期供需格局趋于过剩，价格预计持稳。
20210201,锂行业：21年1-2月，部分锂盐厂停产检修，节后采购热度不减，有望推动碳酸锂价格继续上行。海外新能源汽车市场高景气延续，氢氧化锂需求增加，价格有望进一步走高。
20200708,钢铁行业：当前产量过高，叠加二次累库、南方洪灾以及需求淡季等因素，预计钢企将面临减产压力。然而，随着下半年需求的恢复，油价有望回升，这将有助于行业盈利的逐步改善。此外，铁矿石供应和港口库存的上升可能导致矿价见顶，而钢价则因减产而相对矿价有所支撑。
20200708,石化行业：油价下跌导致一季度行业整体亏损，但随着油价的回升，行业盈利有望逐步改善。本轮油价反弹的主要原因是OPEC+减产协议的执行以及美国原油产量的减少。目前油价仅恢复到盈亏平衡点附近，仍处于较低水平，期待下半年需求恢复以带动油价回升。
20200708,铜行业：货币政策反映经济周期，全球经济复苏时铜价回暖，伴随美联储加息。然而，受新冠疫情影响，全球经济预期下行，美联储降息以释放流动性托底经济，铜价反映经济下行的需求不振。随着全球疫情的逐步缓解，铜价有望回暖。
20191210,随着天气变冷，北方钢材需求季节性减弱，建筑钢材贸易商成交量下降，库存积累速度加快，可能对后续钢材价格产生影响。
20191210,12月份环保限产政策相对宽松，电炉复工积极性较高，预计钢材产量将有所上升。
20191210,钢材需求减弱，供给增加，加上北材南下资源增多，预计钢材现货价格将以震荡下跌为主。
20191210,12月开始，国内企业在缺货背景下调价，但合盛硅业装置即将恢复生产，有机硅涨价势头可能因货源增加而逐渐冷却。
20200614,纯碱价格下跌，有利于浮法玻璃厂家降低成本，提高利润空间。
20200614,汽车和挖掘机产销表现强劲，有望带动卷板需求上升。
20210103,玻纤行业：多数厂家玻纤价格持平，仅长海股份上涨。深加工订单饱满，库存偏低，价格有望上涨。
20210103,钢铁行业：受低温天气及临近春节需求萎缩影响，钢材消费周环比回落，社会库存和钢厂库存开始累积，钢材价格出现回调。但预计冬储及需求季节性回调对钢价影响有限。
20210103,铁矿石行业：铁矿价格与钢价类似，均出现周环比回调，但目前港口、钢厂库存均较低，矿价回落幅度或有限。
20210103,铜行业：宏观方面喜忧参半，市场情绪偏谨慎，铜价短期高位震荡。
20210103,铝行业：限产、限电、限气和贸易商年底进入结算期造成铝下游订单小幅趋弱，短期价格或持稳震荡，企业盈利有望维持高位。
20210103,钴行业：11月进口整体均价同环比均上涨，使得国内钴冶炼厂原料及产品库存成本增加，对冶炼品价格支撑作用增强。
20210103,锂行业：节前备货及市场看涨情绪高涨，导致部分下游出现超量采购，或推动碳酸锂价格继续走高。
20190917,螺纹钢产量连续7周回落，主要原因是废钢价格强势背景下电炉减产检修增多。
20190917,9月施工旺季来临，建筑钢材需求明显好转，前期受高温、雨水天气影响的终端需求延后释放叠加部分终端中秋节前补库。
20190917,黄磷供应紧张，云贵川相关园区环保核查导致黄磷工厂或停炉或降负荷生产，开工不稳定。
20190917,黄磷价格上涨过快，下游市场跟涨困难，补货谨慎，成本压力化解困难，部分下游按需采购，新单偏少。
20181202,波司登公司的业务发展情况：作为羽绒服市场的绝对龙头，波司登在经历了一段时间的业务下滑后，通过一系列积极的转型措施，如优化零售网络、加强线上销售、调整营销策略等，成功实现了业务的恢复性增长。
20181202,波司登公司在高端产品线的布局：通过引入时尚元素，提高品牌溢价，拓展利润空间，减少竞品竞争，波司登已经在高端产品线方面取得了一定的成果。
20181202,波司登公司的品牌发展战略：公司正在积极推进品牌宣传重塑、店铺及销售网络的改进、设计师合作等方面的举措，以进一步提升品牌形象和市场地位。
20170425,原油库存有望继续下降，为油价上涨提供支撑。
20170425,受油价下跌影响，石脑油、苯、甲苯、二甲苯价格均有所下跌。
20170425,锆英砂价格首次上涨，库存低，供给端刺激为主要原因。
20170425,我国对美国钢材出口已大幅缩小，影响有限。
20170425,若美国对进口钢材征税力度过大，可能影响我国出口和出口利润。
20170425,国内线需求旺于国际线，主要受人民币贬值和出境游旅客回流影响。
20170425,散运市场持续低迷，船东盈利刺激二手船舶市场交易。
20170425,油运市场受供给增速过快和需求季节性回落影响，运价持续承压。
20170425,水泥需求端有望表现良好，供给端释放相对有序，基本面有望持稳。
20170425,部分调和油生产企业和地方炼厂通过生产成品油获得更大利润空间，与中石化、中石油竞争。
20170425,调和原料消费税的征收将影响调油商利润，提高中石化、中石油竞争优势。
20170425,石墨电极价格上涨，16年业绩同比增长117%。
20170425,煤炭价格下跌，但有供给侧结构性改革和276支撑，不具备大幅下跌空间。
20170425,水电同比下降，火电增长较快，煤炭供需情况仍好于市场同期。
20170425,澳洲飓风影响或将结束，焦煤供给将增加。
20170425,前期市场预期过高，需求未完全兑现，尤其是制造业用钢。
20170425,大宗商品运输需求下滑，油价大幅上涨，运力增速上行等风险因素。
20170425,货币收紧预期和地产调控持续加码压制水泥板块估值。
20170425,基建加速、地产投资暂稳支持水泥需求端表现。
20170425,纯碱价格大跌，但玻璃价格相对走平，盈利大幅回升，后续仍有进一步提价动力。
20170425,国内装饰建材行业散乱无序，龙头企业市场份额将加速集聚。
20190722,非限产钢厂增产及炼钢废钢消耗量增加，导致钢材总产量持续增长。
20190722,螺纹钢、热卷产量增加，表明区域性环保限产对钢材总产量的影响较小。
20190722,环保限产预期可能发生变化，影响钢材走势的核心因素可能重新聚焦。
20190722,焦炭涨价可能导致钢材利润空间受到挤压。
20190722,黄磷短期供给难以恢复，价格大概率将继续上涨，但下游产品价格上涨幅度可能难以覆盖成本端的上涨。
20191201,华东华南地区水泥价格受赶工需求推动持续上涨，河南地区则因环保限产放松导致价格回落。
20191201,C3产业链产品如环氧丙烷、丙烯酸及酯等价格上涨，主要受工厂意外降负运行和密集检修影响。
20191201,棕榈油相关产品如棕榈油、棕榈仁油、脂肪醇等价格继续上涨，进入减产季节是主要原因。
20181029,动力煤价格短期承压，但后续有望得到支撑，原因包括进口煤管控预期、国内新增产量释放慢、环保检查影响煤矿生产等因素。
20181029,焦煤方面，环保检查导致供应偏紧，下游环保限产不及预期，叠加冬季储煤准备下补库积极，短期内炼焦煤价格走势偏强。
20181029,焦炭方面，受高利润影响焦企开工积极，下游钢厂采购意愿回升，短期内焦炭价格或维持稳中偏强。
20181029,猪价短期承压，中长期有望实现周期反转。
20181029,鸡苗价格保持高位增长，禽养殖板块景气度或将持续。
20181029,中国煤炭运输主流向为北方至南方，其中“西煤东运”、“北煤南运”对中国经济发展尤为重要。
20200408,由于疫情影响，小微企业受到严重冲击，政府采取税银联合方式支持小微企业复工复产。
20200408,随着经济逐渐恢复，基建投资增速上行，同时单位投资用钢强度提升，这将推动基建用钢需求的增长。
20181030,钢铁行业采暖季限产方案基本出炉，整体限产幅度在30%-40%左右，虽然限产比例低于去年，但范围扩大。
20181030,由于钢厂通过添加废钢等手段增产的工艺较为成熟，因此采暖季限产对钢材产量的影响有限。
20181030,四季度钢价走势应更关注需求端的可持续性。
20181030,短期内焦炭需求无忧，但后续需求仍需具体观察采暖季限产对钢厂生产的影响。
20210120,高值耗材行业：疫情期间，医院接诊量大幅下降，高值耗材销量普遍下滑。2020年下半年恢复正常水平。长期看，受益于消费升级、公立医院资源外流等因素，部分专科领域如口腔、医美等仍有较大发展空间。
20210120,光伏行业：硅片龙头、二线企业及一体化企业均有产能释放，价格有下降压力。上游硅片有降价潜力，电池环节供给扩张较快。辅材环节价格有所回落，但结合供需及电站造价降价诉求，价格仍将向下。
20210120,风电行业：陆上风电项目造价的下降，目前在无补贴的情况下，资源优秀地区的风电项目收益率仍有保障。
20210120,火电行业：由于用电量需求的快速恢复，短期内火电利用小时数可能有所提升，但中长期来看，火电的定位将逐步转化为主力调峰电源类型，利用小时数难以重回高位。
20210120,猪肉行业：近期生猪价格受年前旺季需求拉动上涨明显，但仔猪价格有一定反弹。
20210120,乳制品行业：乳制品终端需求保持稳定增长，核心乳企正在联合大型牧场主加速向上游扩张整合。
20210120,小家电行业：疫情下，安装属性较强的空调、冰箱、洗衣机等产品销售下滑程度更为明显。高价值品类与集成产品表现出较高景气度，实现量价齐升。
20210120,快递行业：线上消费拉动快递市场高增长，价格战致巨头业绩分化。目前价格战还要持续1～2年，中通市场份额、单票成本仍将保持优势，利润保持增长；韵达和圆通市场份额增长，但收入增速下滑、利润增长承压；申通和百世市场份额或将萎缩，申通进入亏损边缘，百世亏损扩大。
20210120,仓储物流行业：随着越来越多的开发商关注高标仓市场，市场供应量的变化成为市场基本面的主导力量。
20210120,医药行业：受疫情影响，医院渠道药品销售萎缩，三大渠道销售上半年不同程度下滑，并发生结构性变化。
20180820,动力煤价格进入筑底期，主要原因是港口和坑口价格倒挂，进口煤与国内煤倒挂，贸易商挺价、惜售意愿强烈，下游电厂煤耗量逐步回升，库存压力减少。
20180820,焦煤方面，受环保影响，产业链开工率受限，焦煤整体库存处于中等水平，但库存可用天数持续较高位，炼焦煤价格持续承压。
20181126,全国水泥产量同比增长2.6%，显示市场需求稳定增长。
20181126,钢价回调主要受天气变冷影响，工地施工受限，钢材需求季节性减少；环保限产政策和冬储需求也对钢价产生影响。
20181126,有机硅价格短期内可能稳中趋弱，长期看价格将高位回落，有利于下游企业利润回暖和基本面改善。
20181107,螺纹钢产量在高利润背景下维持高位，采暖季限产或对钢材产量影响或低于理论值，表明钢铁行业供应充足。
20181107,焦炭市场供需两旺，环保限产影响不大，高利润驱使下维持高开工，下游钢企高炉维持高开工，存在补库需求，短期焦炭价格偏强运行，说明焦炭市场供应紧张。
20190507,钢铁行业供给端，当前钢材产量较高，受利润驱动，钢厂保持高产量的意愿强烈，且短流程钢厂仍有扩产空间。
20190507,需求端方面，5月份钢材需求预计会季节性减弱，但根据当前的高频数据，短期内需求大幅回落的可能性较小，因此钢材需求可能会平缓下滑。
20190420,互联网公司进入成熟期后，用户量趋于稳定，营销成本下降，收入增长放缓，但由于成本边际效用，盈利仍能快速增长。
20190420,SaaS产品的收益周期较长，与传统管理软件的直接销售模式相比，收益与获客成本在时间上不匹配，导致初期利润率压力较大。
20190420,在转型过程中，由于SaaS业务模式的影响，客户的收益期拉长，初始收益下降，因此收入可能出现一定下滑，净利润也面临压力。
20191013,建材行业：中南区域需求恢复旺盛，水泥玻璃价格持续上涨。
20191013,钢铁行业：上周钢材需求环比上升40%，但相比节前一周有所下降。无锡高架桥坍塌事件可能影响钢卷运输监管，或提振热卷价格。
20191013,有色金属行业：中长期看，基本金属需求仍不乐观，但短期看，铜、铅锌等价格有望企稳反弹。
20191013,贵金属行业：全球货币宽松趋势下，贵金属价格有望上涨。
20191013,小金属行业：关注钨、钴和钛等持续涨价可能性较大的品种。
20191013,石油化工行业：伊朗油轮遭攻击引发供给侧担忧，推动原油价格上涨。
20181021,手机机壳行业具有周期波动特性，同时受技术创新影响。技术领先的企业首先获得高利润率，但随着竞争加剧，利润率逐渐下滑，直至价格降至落后企业的现金成本，此时老产品利润率触底。
20181021,新产品不断迭代，技术领先企业在创新过程中享受新产品带来的红利，新产品随后进入新一轮周期。
20191029,国内有机硅市场疲软，主流大厂维稳为主，降价操作可能对市场产生加重影响。
20191029,9月份我国规模化企业的生猪和能繁母猪存栏量部分地区进入回升阶段，猪料消费增长，意味着我国生猪产能下降势头已明显缓解。
20191029,国内贸易商报价持续松动，按需采买为主，实际成交价格因生产日期、品牌及采购量等因素略有差异。
20191209,钢材需求季节性走弱，受天气因素影响，北方建筑钢材贸易商的成交量下行，库存积累速度加快，可能对钢材价格走势产生影响。
20191209,12月份环保限产环比宽松，电炉复工积极性较高，预计钢材产量将继续上升。
20191209,钢材供给环比回升，北材南下资源增多，预计钢材现货价格将以震荡下行为主。
20191209,12月开始，国内企业在缺货背景下开始调价，但合盛硅业装置即将恢复生产，有机硅涨价势头可能因货源增加而逐渐冷却。
20200426,财政收支：2020年一季度全国公共财政收入和支出同比增速分别为-14.3%和-5.7%，其中与基建相关的支出如农林水、交通运输、城乡社区事务等同比增速分别为-3.6%、-16.5%和-23.6%。
20200426,钢铁行业：3月份交通运输类支出下滑幅度有所收窄，但前三个月投向基建的财政资金出现较大幅度下滑，可能与基建项目开工率和生产效率偏低有关。此外，废钢相对过剩可能导致钢铁供给曲线坍塌，建筑用钢产量环比持续走高，库存相对往年同期仍将维持高位，这些因素可能对钢价产生下行压力。
20200426,有色金属：上周国内六种基本金属中铝和镍价格上涨，贵金属金银价格上涨。新能源汽车补贴新政或对动力电池和钴锂等新能源金属构成利好，近期铜价大幅下跌使得主流铜钴矿山盈利空间大幅收缩，后续供给或进一步下降，判断钴价已处于底部区间。
20200426,原油：供过于求状态持续、存储空间紧张，国际油价大幅下跌。
20200426,农药：印度处于封城状态导致进口量减少，菊酯类农药价格稳中向上。
20190723,非限产钢厂增产及炼钢废钢消耗量增加，推动钢材总产量持续增长，近期螺纹钢、热卷产量增加，显示区域性环保限产对钢材总产量影响较小。
20190723,环保限产对钢材产量的影响可能使市场对环保限产的预期发生变化，影响钢材走势的核心因素可能重新聚焦。
20190723,焦炭价格上涨可能对钢材利润空间产生挤压，供给收缩预期持续加强，焦炭价格中枢可能上移。
20190723,黄磷短期供给难以恢复，尽管处于行业淡季，黄磷价格可能继续上涨，但下游磷酸等产品需求不足，价格上涨难以覆盖成本上涨。
20191130,近期公司股价受到行业预期与情绪波动的影响，出现了调整，目前的估值已经处于历史最低水平。
20191130,从行业角度来看，随着国内需求的逐步启动，光伏行业的供需关系在短期内得到了改善，PERC电池的价格也出现了小幅上涨。
20190807,钢铁行业：由于高温天气和西南地区雨水天气的影响，建筑钢材需求增量有限。同时，高产量对钢材价格产生压制作用。7月以来，废钢价格持续上涨，导致部分独立电炉厂陷入亏损状态，部分小规模电炉钢厂已经开始停产检修。这可能导致螺纹钢价格得到一定支撑。
20190908,螺纹钢需求环比上升10.1%，可能是天气变凉和房地产建设需求旺盛所致，这将有利于宝钢股份等下游需求包含汽车用钢的钢铁企业。
20190908,第四季度汽车销量可能回暖，汽车用钢需求有望改善。
20190908,原油价格因美伊局势紧张和美油库存下降等因素继续反弹，这将对PTA-涤纶产业链产生积极影响。
20190908,C4产业链中的丁二烯价格震荡整理，丁酮价格大幅上涨。
20190908,PTA-涤纶产业链下游需求回暖，库存明显下降，PTA和涤纶价格小幅反弹。
20190908,磷化工方面，供应偏紧推动黄磷价格持续上涨，但下游产品价格传导困难。
20190925,钢铁行业近期螺纹钢产量止跌回升，主要原因是钢价上涨带动电炉开工率上升。
