Date,Content
20201116,煤炭供应：反腐及安监政策对煤炭产量产生持续影响，预计2021年上半年产量增速仍将维持低位。进口方面，受政策调控及澳大利亚煤炭进口不确定性影响，预计2021年进口总量将保持在2.8-2.9亿吨水平，结构上动力煤占比或有所增加，焦煤进口量因澳大利亚焦煤进口减少，占比可能略有下降。山西等地煤炭国企整合或将减缓生产释放节奏。
20201116,煤炭需求：预计2021年煤炭需求将向好，主要受制造业景气及用电增长推动，地产产业链需求有望保持一定韧性。煤价方面，预计2021年在供需小幅改善背景下，煤价将进一步向好，动力煤港口标杆煤价有望升至570元/吨附近，同比增幅约2%，长协煤价涨幅预计在1%左右。焦煤价格上半年有望延续强势，全年均价预计有10%左右的涨幅。
20190422,有机硅市场近期呈现僵持状态，部分企业由于货源紧张而提高报价，但个别企业因库存积压和出货速度放缓而出现价格下滑，市场心态出现分歧。
20190422,终端需求方面，部分企业以消化库存为主，新开工项目增速放缓，这对有机硅行情的上行构成利空影响。
20190304,近期基建项目加速启动，对建筑用钢需求形成稳定支撑，同时政策利好刺激制造企业原料补库，拉动热卷需求超过预期，钢材价格有望迎来新一轮上涨。
20190304,单体企业库存低位，下游接单活跃，叠加3月份需求旺季逐步到来，有机硅价格大概率持续回升。
20190304,今年1-2月份下游需求旺盛，电解液市场活跃度有所提升，订单成交量较前期明显增多，短期内电解液价格有望提升2000元/吨。
20200220,受疫情导致的复工延后影响，钢材供给持续收缩，钢价及厂库压力加大。
20200220,建筑钢材需求恢复仍需时日，现有库存压力大，对钢材价格产生压力。
20200220,短期内建筑钢材价格回落或难以避免，但降幅有望收窄。
20200220,疫情对钴盐原料运输产生影响，推动钴价上涨。
20200220,基本金属需求受疫情影响下降，中长期关注基本金属基本面。
20190131,钢铁行业需求预期乐观：由于房屋新开工面积增加，房地产用钢需求有望延续至春节后，因此对春节后钢铁需求持不悲观态度，认为节后开工钢铁或将面临短期的供需紧张局面，钢材价格有望实现阶段性上涨。
20190131,巴西矿难影响铁矿石市场：此次矿难进一步提振了黑色市场情绪，当前铁矿石供需偏紧格局或将加剧，需关注事故后续影响。
20190131,磷矿石市场短期波动：临近春节，运输紧张导致磷矿发运压力增加，下游工厂仍有少量补货，成交价格重心小幅走高，但对磷矿石市场刺激有限。
20200906,玻璃行业涨价向上游传导，重碱、轻碱价格环比分别上涨7%、5%。
20200906,玻纤价格在9月实现涨价，下游需求旺盛有望继续推升价格。
20200906,高炉产能利用率连续四周下行，考虑到铁矿价格高位和需求边际走弱，预计后期矿价或将下行。
20200906,煤炭重点港口和电厂库存均处于下行且低于去年同期，预计9月水电挤压效应消退后，动力煤需求和煤价或将上行。
20190722,游戏直播市场竞争激烈，熊猫平台的关闭使斗鱼受益于新主播的加入，有望推动其盈利增长。
20180910,钢铁行业：由于地产高周转带来的钢材需求增量边际正在衰退，今年取暖季粗钢限产量较去年同期增加，其中约50%为长材。这表明钢铁行业的供需关系正在发生变化，限产可能导致短期内钢材价格上涨。
20180910,水泥行业：华东企业熟料库存较低，安徽限产加剧熟料区域性缺口。这可能意味着水泥供应紧张，价格上涨。
20180910,染料行业：原料成本上升推动分散染料提价，部分中间体和分散滤饼原料出现大幅度涨价。此外，环保限产压力下中间体短缺问题依旧。这表明染料行业的供需关系紧张，价格上涨。
20200107,近期螺纹钢表观消费量连续四周回落，但社会库存涨幅创库迎来新高至 41.21 万吨，主要受需求回落和冬储启动双因素影响。
20190325,建筑钢材现货价格在需求释放的影响下呈现震荡上行走势。
20190325,五大钢材需求季节性增长，增值税下调有望提升终端实际需求表现。
20190325,铁矿石市场受多方消息面影响，钢厂补库可能带动铁矿石价格上行。
20190325,短期内铁矿石供给减弱，需求端走强，短期铁矿石价格可能上涨。
20190325,天嘉宜事故导致间苯二胺供应短缺、价格上涨，推动分散染料、活性染料价格上涨。
20200302,受疫情影响，2019年12月至2020年1月，淘宝总GMV呈现下降趋势，主要原因是物流及区域住宅管制状况影响。
20190314,钢材产量同比上升，受益于行业资金面宽松、政府逆周期调节和地方债发行规模扩大，基建用钢需求成为钢铁业需求亮点。
20190314,钢企资本开支减少，分红预期增强，钢价上涨和高分红预期可能提高板块关注度。
20190314,单体企业开工正常，但库存处于低位，下游接单活跃，有机硅价格有望继续回升。
20190314,负极材料价格短期稳定，但长期存在降价压力。
20190314,需求端，下游补贴滑坡可能倒逼负极材料企业降价；成本端，原料价格下行无法对负极材料提供价格支撑。
20210301,电解铝：供需格局持续改善，铝价有望持稳，企业盈利处于相对高位。
20210301,碳酸锂：21年1月中国碳酸锂产量环比减少15.1%，锂盐厂停产减产明显，供需缺口大，价格有望继续上行。
20210301,化工产品：醋酸及衍生物、丙烯酸及酯、聚氨酯等产品供应紧张，价格上行。
20210301,钢铁：钢价短期或仍可上行，但需关注地产、基建投资偏弱可能导致的长材价格回落风险。
20190916,原油进口：我国从沙特进口的原油占比增长至17%，可能威胁到我国的原油进口安全。
20190916,能源安全：保障能源安全仍需加大国内原油勘探开发的力度，降低开采成本和提高产量。
20190916,煤炭价格：煤炭供给收紧和终端补库可能导致煤炭价格小幅反弹，但中长期需求端难有较大起色，煤炭价格或难持续性上涨。
20190916,焦炭需求：下游钢材需求好转，焦炭有望进入补库阶段和价格上涨周期。
20190916,汽车销量：汽车销量见底回升，汽车消费促进政策有望拉动汽车用钢需求。
20190916,黄磷市场：黄磷供应紧张，下游市场跟涨困难，补货谨慎。
20190916,负极材料市场：中低端负极材料市场竞争激烈，高端负极材料市场价格相对稳定。
20190916,茅台酒价格：茅台批价回落明显，主要原因为经销商大量放货、公司严查库存、前期批价上涨存在泡沫以及直营渠道放量等因素。
20190916,白酒销售：今年中秋节旺季变淡，主要原因为消费平时化、酒企挺价以及中秋国庆间隔较远等因素。
20191111,钢材市场预期悲观，贸易商冬储需求可能减弱，原因在于供需转弱以及冬储性价比降低。
20191111,环保限产对钢材供应产生影响，今年秋冬季气象条件较差，重污染天气较多，可能导致实际产量减少。
20191111,虽然部分贸易商报价上涨，但工厂报价仍然较高，显示出市场供需矛盾依然存在。
20191107,今年冬储环境较去年不同，主要表现在市场对明年钢材供需预期悲观，冬储意愿差；钢厂盈利状况不佳，资金实力下降。这可能导致贸易商冬储需求减弱。
20200120,房地产周期对黑色产业链的走势有关键性的影响。地产新开工增速作为房地产周期的先行指标之一，拉动整个黑色产业链上下游的需求，下游需求增加拉动煤炭价格上升，进而影响相关板块的收益表现。
20200120,煤炭板块受价格周期影响、盈利波动大的特性越来越难被市场认可，板块估值难以提升，且后工业化时代煤价或易跌难涨，板块相对收益或越难获得。
20200120,高通胀常形成于经济总需求上升期，往往是由货币超发引发的，助推板块估值提升。
20200120,钢铁价格与钢铁企业盈利主要受供需影响。
20200120,房地产作为钢铁下游主要需求之一，新开工大幅增长一般会增加钢材需求。
20200120,水泥板块相对收益与房地产周期密切相关，地产新开工的周期性变化对水泥行业的需求变化起到带动作用。
20200120,航空板块出现大机会最重要的因素是供需，与宏观经济密切相关，即航空是顺周期品种，经济好则航空板块出现机会的概率大。
20200120,火电股相对收益与煤价、CPI 增速等因素密切相关。煤价上涨使火电盈利恶化，股价下跌；CPI 上涨时一般也伴随着股市估值的上行。
20181109,焦炭方面，基于环保压力，预计焦炭将继续维持供需偏紧的格局，价格或上涨 5%。
20181109,煤炭行业，宏观经济增速放缓或环保限产力度加大可能影响煤炭需求；环保、安全监管因素放松，产能集中释放可能压制煤价。
20181109,电力行业，2018年以来用电量持续增长，主要由工业领域、制造业、电力行业自身以及公共服务相关行业贡献。
20181109,钢铁行业，2019年预计将出现供给略宽松的格局，煤价中枢虽有所下移，但还可维持高位。
20181109,宏观经济方面，国内外钢铁需求在2019年将略微下滑，出口需求也将承压。
20190211,Vale矿难事故可能导致全球铁矿石供需从略宽松转向缺口，推高矿价中枢至90美金附近，并使钢厂短期铁矿石成本上升约150元/吨。
20190211,2-3月份，市场关注焦点集中在下游需求幅度，看好钢价春季复苏行情。
20190211,国内石墨化产能供应将趋于宽松，西南地区及北方地区石墨化产能扩张明显，预计石墨化加工费用将出现松动，降低负极材料企业成本。
20190311,2018年钢铁行业整体盈利较好，资本开支减少，分红预期强烈，钢价上涨和高分红预期可能提高该板块的关注度。
20190311,有机硅市场价格可能在需求旺季和下游接单活跃的情况下继续上涨。
20190311,负极材料价格短期内稳定，但长期存在降价压力。
20190311,需求端来看，下游补贴滑坡可能导致负极材料企业降价；成本端来看，原料价格下跌无法对负极材料提供价格支撑。
20190812,钢铁行业：上周钢材社会总库存增加1.2%至1300万吨；电炉减产影响粗钢产量约2.7万吨/天；螺纹钢表观消费量下降，全国贸易商建筑钢材成交量小幅下滑，钢材需求端表现偏弱；电炉减产、陕晋甘川钢厂主动限产等因素可能影响钢材价格走势。
20190812,有机硅行业：8月份企业检修减产情况普遍，市场供应明显下滑，货源紧张；但需求端复苏缓慢，压制市场价格上行速度。
20190812,负极材料行业：7月负极材料整体产量减少，大型负极材料企业产量变化不大，中小型企业产量有所下降。
20180305,农业板块本周继续回暖，其中猪鸡价格分化明显。受春节后生猪价格大幅下跌影响，生猪养殖板块回调较多，但估值安全边际较高，可适度关注龙头养殖企业。
20180305,禽链方面，由于上游祖代鸡进口受限及换羽进入瓶颈期，预计禽链反弹将持续，可关注有核心育种资源的上市公司。
20180305,煤炭行业受益于供给侧改革，新增产量有限，煤价有望维持中高位，龙头煤企业绩具备可持续性，估值水平存在修复空间。
20200323,受疫情影响，2019年12月至2020年2月期间，淘宝总GMV呈现下降趋势，主要原因是物流及区域住宅管制状况影响。
20200323,尽管整体消费下降，但以阿里健康为代表的医药卖场型店铺销量降幅相对较小，显示出在线医疗消费的韧性。
20210124,物业行业受到政策支持，表现出高景气度，具有可选消费和必选消费的双重属性，业绩确定性较强。
20170514,水产品价格上涨，鱼价走高，推动水产养殖户收入增加。
20170514,动力煤需求季节性下滑，大秦线检修后港口供给可能进一步宽松，动力煤价格持续下滑，符合预期。随着夏季来临，下游需求和补库存需求增加，动力煤价格有望反弹。焦炭整体库存回归合理水平，钢厂持续打压焦炭价格，中短期基本面平稳，关注需求变化。
20170514,煤炭价格全年价格中枢有望大幅提升，煤炭企业业绩高弹性，全年业绩有望大幅提升，建议关注盈利能力良好且业绩弹性高的标的公司。
20170514,年初至今，高炉开工率上升，钢材库存增加，钢材价格回调。
20170514,电解铝成本高企，新疆昌吉州停止违规在建电解铝产能200万吨，市场对电解铝供给侧改革的预期有望利好电解铝价格。
20170514,近期油价跌幅较大，利好航空成本端。
20170514,玉米价格上涨，但涨幅有限，暴涨几率较小。
20170514,2018年生猪供应或加速恢复，下半年供需两旺，但整体产能恢复程度不大，供应难有大幅回升，猪价无大跌基础。
20170514,农业部报告，4月28日，河北省邢台市邢台县兽医部门发现一养殖场饲养的蛋鸡出现疑似禽流感症状，发病8500只，死亡5000只。
20191110,玻纤行业部分中低端建筑建材产品价格自11月8日起上涨150-200元/吨，有望推动20年整体供求再平衡。
20191110,螺纹钢价格在广州、杭州地区同环比增幅较大，可能对当地钢价产生冲击。
20191110,C4产业链方面，装置检修利好及成本面支撑使丁二烯价格大涨，进而影响丁酮价格上涨。
20191110,油脂化工产业链方面，棕榈油有望迎来较大幅度减产周期，带动棕榈油、棕榈仁油、脂肪醇价格持续上涨。
20190113,家电行业受地产周期拖累以及周期性因素影响，2018年家电内销增速呈现下降趋势。
20190113,2009年家电下乡政策刺激效果显著，新政出台后，大家电和厨卫电器有望受益。
20190113,波司登作为羽绒服绝对龙头，经历过阵痛后重回快速增长。公司通过一系列措施实现转型，包括优化零售网络、加大线上销售供应链和物流优化、采用新媒体营销策略等。
20190113,波司登品牌重塑，进入新的增长轨道。公司在高端产品线、品牌宣传、店铺及销售网络改进、设计师合作等方面取得进展。
20190608,婴幼儿配方乳粉行业：中国政府持续推动婴幼儿配方乳粉行业的供给侧结构性改革，旨在优化产业结构、提升产品质量、创立产品品牌，以促进该行业的全面振兴。
20190608,羊奶粉市场：佳贝艾特作为羊奶粉市场的绝对龙头，具有明显的竞争优势。随着荷兰Hector/Pluto、新西兰PNL和中国智慧工厂的投产，预计将带来产能的增长，推动公司2019-2020年净利润持续增长。
20190608,美妆家居B2C电商：美妆家居进口需求增长与出口供应品类增加有望共同推动B2C电商规模的崛起。
20190608,PCB行业：受美中贸易摩擦和国际铜价下跌的影响，PCB上游原物料市场发生变化，PCB厂不愿在此时多堆库存，预计这种影响在6月将更严重。
20190321,螺纹钢库存方面，当前钢厂库存占比高于去年同期，主要由于贸易商冬储积极性差，钢材多集中在钢厂环节，有利于钢材价格保持韧性。
20190321,负极材料受下游市场压力影响，价格承压，但市场运行相对稳定，生产企业明显受到来自下游的降价压力，买卖双方就新订单的价格展开激烈博弈。
20190321,新进入厂家低价竞争对大厂形成压力。
20190321,近期有机硅市场价格继续上调，市场呈现供需两旺格局。
20181022,疫情对北方地区生猪市场产生较大影响，导致生猪价格下跌，但长期看疫情有望推动猪价周期反转。
20181022,禽养殖方面，1-9月国内祖代引种量同比下降13.3%，全年引种量偏紧，可关注禽养殖板块相关标的。
20181022,动力煤价格短期承压，但后续有望得到支撑，主要受进口煤管控、国内产量释放慢、环保检查等因素影响。
20181022,焦煤方面，环保检查导致供应偏紧，下游环保限产不及预期，叠加冬季储煤准备下补库积极，短期内炼焦煤价格走势偏强。
20181022,焦炭方面，受高利润影响焦企开工积极，但下游钢厂有压价意愿，短期内焦炭价格或有反弹。
20170926,新能源汽车市场回暖，锂电池需求增加，但政策补贴退坡导致电池企业面临较大降价压力，整车企业与电池厂之间的供需关系出现反转。
20170926,受油价上涨的影响，上周苯、石脑油价格上涨，涨幅分别为 2.84%、2.44%，上周亨利中心天然气价格从 3.04美元/千立方英尺上涨至 3.11 美元/千立方英尺，涨幅为 2.30%。
20170926,动力煤四季度仍可涨价，市场担忧需求及国家调控价格。
20170926,冬季限产再加码，继续看好周期建材（水泥、玻璃），预计四季度水泥价格有望迎来超预期上涨；预计四季度玻璃价格亦将有超预期表现。
20170926,油价反弹的原因分析：（1）6 月油价下跌 17%基本对原油库存增加、美元加息、卡塔尔断交风波等利空有了较充分的风险释放；（2）美国原油库存的持续下降、美元走弱等带动油价反弹；（3）沙特有意减少原油出口量、沙特阿美上市预期等助推油价上涨。
20170926,环保行动使得中国钨金属供应存在不确定性，钨价上涨。
20170926,盐湖、国内锂辉石、锂云母纷纷投产，供给上行预期导致市场担忧供需格局会改变，从而压制碳酸锂价格。
20190530,螺纹钢产量连创新高，短期内需求向好，但6月建筑钢材需求预计将出现季节性回落，产量可能对钢价产生压制作用。
20190530,房地产用钢需求超出预期，不悲观，主要受新开工面积高增速和2016-2018年房屋竣工面积增速持续低位的影响，预计今年房地产后端施工可能有赶工可能，对钢铁需求形成一定支撑。
20190530,铁矿石企业有望受益于铁矿石价格上行，表现较好。
20190530,短期来看，负极材料与动力电池使用时的容错率较低，更换供应商可能性不大，价格相对平稳。
20190530,长期来看，大型负极材料企业新增石墨化产能和扩建负极材料产能预计在今年下半年得到有效释放，成本端前期原料下行将显现，负极材料价格预计在下半年可能出现小幅下行。
20190530,随着周边地区厂家价格的调整及产能增加，沙河地区在周边市场的竞争能力略有下降。
20190530,前期东北地区厂家价格调整对华北市场产生影响。
20190530,部分厂家为清理库存，报价下调幅度较大。
20190530,后期临近小长假和农忙等因素，不利于玻璃加工企业订单稳定。
20190416,钢材价格持续上涨，需求较好，尤其是华东、华南等地的需求正在逐渐释放，建筑钢材的需求有望维持。
20190416,钢材产量小幅增加，但当前的供给端增量对钢材价格的压力较小。
20190416,钢材价格上涨的主要原因是钢厂高炉复产，以及刚需补库促使港口铁矿石成交放量。
20190416,港口到货量仍处于低位，钢厂采货积极性相对旺盛，预计短期内铁矿石价格具有较强的韧性。
20190416,建议关注区域供需向好，成本控制能力强的优质钢企及受益于铁矿石价格上行的铁矿石企业。
20190416,染料展会期间，中间体及染料成交活跃，下游对分散染料涨价的接受度较高，需求旺季可能导致染料价格进一步上涨。
20190416,活性染料方面，关键中间体H酸的报价从不到4万元/吨抬升至4.5万元/吨，后期有望进一步提价，带动活性染料价格上涨。
20181205,钢铁行业：钢材总库存小幅上涨，短期内钢材产量对钢价的影响或更大。采暖季限产尚未全面展开，高炉开工率小幅上涨，高产量压制下钢材价格难有反弹动力。建议关注后续限产情况。
20181205,房地产行业：下半年土地市场热度减退，土拍溢价率逐月下降，流拍土地数量明显增多。土地降温有望倒逼土地出让环节在定价层面更为合理。房企拿地理性化已逐步影响2018年销售利润率，市场对于房企利润率持续回落的悲观预期有望得到修复。宽松政策预期抬升，地产股估值修复有望延续。
20181205,有机硅行业：11月检修季后行业开工率大概率提高，但需求端下游企业库存充足，高价采购意愿低，预计12月有机硅价格依旧疲软。
20190513,3. 饲料——豆粕价格或将反弹
20190407,汽车行业政策利好，产业促进政策密集推出，有助于降低消费者购车成本和用车成本，从而提高汽车销售量。
20191222,玻纤行业近期价格稳定，市场预期2020年粗纱价格前高后低，电子纱需求向好，价格有望上涨。
20181204,钢材市场库存小幅上涨，短期内产量对钢价影响较大，高炉开工率上升，产量高位压制钢价反弹空间，需关注后续限产情况。
20181204,土地市场热度减退，土拍溢价率下降，流拍土地增多，土地降温有望使土地出让定价更合理，房企拿地趋于理性，市场对房企利润率持续回落预期有望修复，地产股估值修复有望延续。
20181204,有机硅行业11月检修季后开工率可能提高，但下游企业库存充足，高价采购意愿低，预计12月有机硅价格仍疲软。
20200216,玻纤行业保持平稳，需关注需求启动和价格改善的延续性。
20200216,钢材市场库存高企，部分钢厂已进行减产，若局势持续，减产力度可能加大。
20200216,基本金属价格普遍下跌，仅铝和铅有小幅上涨；小金属价格大多上涨，稀土、钴、钨钼价格上涨，碳酸锂价格小幅下跌；黄金价格小幅上涨，白银价格小幅下跌。
20190602,能源：油价受地缘政治风险影响波动较大，关注中东地区局势发展。
20190602,金属：金属价格普遍上涨，其中铁矿石价格创新高，关注钢铁产量对价格的压制作用。
20190602,农产品：受季节性因素和天气影响，农产品价格波动较大，关注玉米、大豆等作物产量和库存变化。
20190602,化工品：化工品价格涨跌互现，关注原油价格变动对化工品价格的影响。
20190602,建材：建材价格普遍上涨，关注房地产投资和基建投资对建材需求的拉动作用。
20190602,轻工：轻工产品价格涨跌互现，关注消费需求变化对轻工产品价格的影响。
20190602,造纸：受原材料价格下跌和需求疲软影响，造纸价格持续下滑，关注宏观经济环境和中美贸易局势对造纸行业的影响。
20190602,纺织服装：纺织服装价格涨跌互现，关注消费需求变化对纺织服装价格的影响。
20190602,食品饮料：受原材料价格上涨和需求增长影响，食品饮料价格普遍上涨，关注消费者物价指数和食品饮料行业政策变化。
20200618,钢铁产业供给侧改革接近尾声，但仍存在两大问题：一是产业链溢价能力较弱，需要提高相对于海外四大矿山的溢价能力；二是钢铁产业尚待进一步转型，包括走向国外分享红利及布局上游资产增强溢价率。
20200618,5月需求超预期推动港口煤价快速反弹，行业预期不断改善。
20200618,有色行业在供给侧改革下，电解铝新增产能需替换旧产能，形成产能天花板，优化产能布局，有助于提升市场长期稳定发展预期。
20200618,铝需求受“新老基建”刺激，地产、汽车等消费环比持续改善，同时低价和疫情影响新增产能释放，前五月产量同比+3.2%。
20200618,氧化铝过剩使电解铝行业维持较宽利润区间，产量快速释放且氧化铝自给率低的行业龙头受益。
20200618,油行业过剩情况加重，炼油行业2019年平均盈利129元/吨，同比下降32%。
20200120,供给端，由于短流程钢厂停产放假，样本钢厂螺纹钢产量出现周度回落。
20200407,基建投资增速上行，单位投资用钢强度提升，预计基建用钢将成为需求端亮点。
20190123,随着春节临近，钢材实际需求可能减弱，但冬储需求将对钢材价格产生支撑作用。
20190123,长期来看，西南和北方石墨化产能扩张明显，有望降低负极材料企业生产成本。
20200119,语文科目培训相较于数学和英语科目，其发展起步较晚，规模相对较小，主要原因是语文科目更依赖名师，且难以实现规模化教学。
20200119,北京地区的王者班销售火爆，人数达到3000人，占北京参培人数的三分之一，显示出高单价课程在北京市场的受欢迎程度。
20180924,建材等周期性较强的行业，其估值水平与盈利情况呈负相关，即盈利低点时估值较高，盈利高点时估值较低。
